<?xml version="1.0" encoding="UTF-8"?>
<dataStore xmlns:xsi="http://www.w3.org/2001/XMLSchema-instance" xsi:noNamespaceSchemaLocation="dataStore.xsd">
	<timer id="2">
		<timerName>timer2</timerName>
		<notes>ala bala 222</notes>
		<dateCreated>Wed Dec 29 00:56:31 EET 2010</dateCreated>
		<elapsedTime>
			<days>2</days>
			<hours>2</hours>
			<minutes>2</minutes>
		</elapsedTime>
	</timer>
	<timer id="1">
		<timerName>timer1</timerName>
		<notes>ala bala</notes>
		<dateCreated>Wed Dec 29 00:56:31 EET 2010</dateCreated>
		<elapsedTime>
			<days>1</days>
			<hours>5</hours>
			<minutes>23</minutes>
		</elapsedTime>
	</timer>
</dataStore>